{
  "evidence_id": "E-CHAIN-PDF",
  "subject": {
    "candidate_name": "合成PDF测试来源（非人物）"
  },
  "evidence_type": "source_supported_fact",
  "claim": "仅验证合成材料中的摘录，不作人物或法律判断。",
  "source": {
    "title": "合成来源（非人物）",
    "publisher": "ADD synthetic fixture",
    "url": null,
    "local_path": "D:\\Arbitrator Due Diligence\\.tmp-add-run-issue13-final\\inputs\\digital.pdf",
    "source_type": "user_provided_file",
    "published_date": null,
    "event_date": null
  },
  "retrieval": {
    "retrieved_at": "2026-09-25T12:32:17.057712+00:00",
    "retrieval_notes": "{\"input_sha256\": \"9a79452a8b056d6f73fbe32fad34f37918830fbf215cbcb39710c94724365e50\", \"pypdf_version\": \"6.19.0\", \"requested_page\": 2}"
  },
  "excerpt": "第二页：仅用于流程测试。",
  "excerpt_locator": "PDF page 2 (one-based); text SHA256=cd795f3a82ce9b4a1b7e5f3ab20fb61eb995af28333f75a5762bb11f10814f3b; characters [0, 12) (zero-based Unicode)",
  "context": "调用者提供陈述；仅验证页内摘录存在。",
  "identity_resolution": "not_applicable",
  "quality": {
    "source_quality": "unknown",
    "provenance_status": "user_supplied"
  },
  "supports": {
    "relevance": "unknown",
    "supports_statement": "语义支持关系待人工复核。"
  },
  "limitations": [
    "仅数字原生PDF文本提取；未执行OCR、身份或来源真实性判断。",
    "PDF page 3: no_text_extracted；不表示该页没有内容。"
  ],
  "uncertainty": "unknown",
  "human_review": "not_started",
  "snapshot": {
    "level": "L3",
    "status": "saved",
    "path": "D:\\Arbitrator Due Diligence\\.tmp-add-run-issue13-final\\pdf-source\\source.pdf",
    "sha256": "9a79452a8b056d6f73fbe32fad34f37918830fbf215cbcb39710c94724365e50",
    "media_type": "application/pdf",
    "notes": "{\"pages_path\": \"D:\\\\Arbitrator Due Diligence\\\\.tmp-add-run-issue13-final\\\\pdf-source\\\\pages.json\", \"pages_sha256\": \"6bdb36268627dc3fe149bba8c9f9610770c1f45f0c696f3d43ab79950d0f394d\"}"
  }
}
